{
  "schema_version": "2.0",

  "meta": {
    "analysis_date": "2026-06-06",
    "prepared_by": "Retirement-Right Advisor",
    "firm_name": "Retirement-Right Advisory",
    "firm_address": "1820 E Ray Road, Suite A-108, Chandler, AZ 85225",
    "report_title": "Comprehensive Retirement Blueprint",
    "confidential": true,
    "notes": "Planning Horizons: Michael to age 88. Karen to age 90. Client health: Fair. Spouse health: Good.",
    "legacy_notes": "Remainder of estate to Eberhardt Children evenly after last spouse dies"
  },

  "client": {
    "first_name": "Michael",
    "last_name": "Eberhardt",
    "dob": "1951-12-22",
    "state": "AZ",
    "filing_status": "married_filing_jointly",
    "health": "fair",
    "planning_horizon_age": 88,
    "retirement": {
      "status": "retired",
      "date": null,
      "date_known": false,
      "retirement_age": 75
    },
    "employment": null
  },

  "spouse": {
    "first_name": "Karen",
    "last_name": "Eberhardt",
    "dob": "1955-05-25",
    "health": "good",
    "planning_horizon_age": 90,
    "retirement": {
      "status": "retired",
      "date": null,
      "date_known": false,
      "retirement_age": 71
    },
    "employment": null
  },

  "assumptions": {
    "inflation_pct": 0.025,
    "rate_of_return": 0.04,
    "income_need_annual": 120000,
    "tax_year": 2024,
    "ss_taxable_pct": 0.85,
    "projection_end_age": 91
  },

  "income": {
    "social_security": {
      "client": {
        "status": "collecting",
        "monthly_benefit": 1700,
        "file_age": null,
        "cola_pct": 0.02,
        "spousal_benefit": null
      },
      "spouse": {
        "status": "collecting",
        "monthly_benefit": 3000,
        "file_age": null,
        "cola_pct": 0.02,
        "spousal_benefit": null
      }
    },
    "pension": null,
    "rental": null,
    "annuity": null,
    "other_income": null
  },

  "assets": {
    "ira_traditional": {
      "client_balance": 0,
      "spouse_balance": 135000
    },
    "ira_roth": {
      "client_balance": 0,
      "spouse_balance": 0
    },
    "ira_inherited": {
      "balance": 288000,
      "year_inherited": 2025,
      "ten_year_rule": true,
      "distribution_strategy": "even",
      "must_distribute_by": 2035
    },
    "brokerage": {
      "total_balance": 1315000,
      "sub_accounts": [
        { "label": "Managed Brokerage", "balance": 515000 },
        { "label": "Money Market",      "balance": 800000 }
      ]
    },
    "annuity_value": 750000,
    "real_estate_equity": 800000,
    "primary_home_value": 800000,
    "cash_and_savings": {
      "client_balance": 0,
      "spouse_balance": 0
    },
    "other_assets": [
      { "label": "Other Assets", "balance": 20000, "investable": true, "growth_rate": 0.0 }
    ]
  }
}
